<?xml version="1.0" encoding="iso-8859-1"?>
<xs:schema xmlns:xsi="http://www.w3.org/2001/XMLSchema-instance" attributeFormDefault="unqualified" elementFormDefault="qualified" xmlns:xs="http://www.w3.org/2001/XMLSchema">
  <xs:element name="characters">
    <xs:complexType>
      <xs:sequence>
        <xs:element minOccurs="0" maxOccurs="unbounded" name="default_states">
          <xs:complexType>
            <xs:sequence>
              <xs:element minOccurs="1" maxOccurs="unbounded" name="state">
                <xs:complexType>
                  <xs:sequence>
                    <xs:element minOccurs="1" maxOccurs="unbounded" name="animation">
                      <xs:complexType>
                        <xs:attribute name="id" type="xs:unsignedByte" use="required" />
                      </xs:complexType>
                    </xs:element>
                  </xs:sequence>
                  <xs:attribute name="name" type="xs:string" use="required" />
                </xs:complexType>
              </xs:element>
            </xs:sequence>
            <xs:attribute name="core" type="xs:string" use="required" />
          </xs:complexType>
        </xs:element>
        <xs:element minOccurs="0" maxOccurs="1" name="player">
          <xs:complexType>
            <xs:sequence>
              <xs:element minOccurs="1" maxOccurs="unbounded" name="state">
                <xs:complexType>
                  <xs:sequence>
                    <xs:element minOccurs="1" maxOccurs="unbounded" name="animation">
                      <xs:complexType>
                        <xs:attribute name="id" type="xs:unsignedByte" use="required" />
                      </xs:complexType>
                    </xs:element>
                  </xs:sequence>
                  <xs:attribute name="name" type="xs:string" use="required" />
                </xs:complexType>
              </xs:element>
            </xs:sequence>
            <xs:attribute name="name" type="xs:string" use="required" />
            <xs:attribute name="core" type="xs:string" use="required" />
          </xs:complexType>
        </xs:element>
        <xs:element name="enemies">
          <xs:complexType>
            <xs:sequence>
              <xs:element minOccurs="0" maxOccurs="unbounded" name="enemy">
                <xs:complexType>
                  <xs:sequence>
                    <xs:element minOccurs="1" maxOccurs="unbounded" name="state">
                      <xs:complexType>
                        <xs:sequence>
                          <xs:element minOccurs="1" maxOccurs="unbounded" name="animation">
                            <xs:complexType>
                              <xs:attribute name="id" type="xs:unsignedByte" use="required" />
                            </xs:complexType>
                          </xs:element>
                        </xs:sequence>
                        <xs:attribute name="name" type="xs:string" use="required" />
                      </xs:complexType>
                    </xs:element>
                  </xs:sequence>
                  <xs:attribute name="name" type="xs:string" use="required" />
                  <xs:attribute name="core" type="xs:string" use="required" />
                  <xs:attribute name="animated_instace_name" type="xs:string" use="required" />
                </xs:complexType>
              </xs:element>
            </xs:sequence>
          </xs:complexType>
        </xs:element>
      </xs:sequence>
    </xs:complexType>
  </xs:element>
</xs:schema>